[
  {
    "id": "allwinner-a133",
    "vendor": "Allwinner",
    "name": "A133",
    "aliases": ["A133"],
    "cores": 4,
    "arch": "Cortex-A53",
    "ram_max_gb": {
      "value": 4,
      "status": "verified",
      "basis": "datasheet",
      "sources": ["src-allwinner-datasheet-a133-v1-1-copie-heberg"]
    },
    "ram_types": {
      "value": ["DDR3", "DDR3L", "DDR4", "LPDDR3", "LPDDR4"],
      "status": "verified",
      "basis": "datasheet",
      "sources": ["src-allwinner-datasheet-a133-v1-1-copie-heberg"]
    },
    "ethernet_max_mbps": {
      "value": 1000,
      "status": "verified",
      "basis": "datasheet",
      "sources": ["src-allwinner-datasheet-a133-v1-1-copie-heberg"]
    },
    "video_max_decode": {
      "value": "4K",
      "status": "verified",
      "basis": "datasheet",
      "sources": ["src-allwinner-datasheet-a133-v1-1-copie-heberg"]
    },
    "community_findings": [
      {
        "topic": "identity",
        "summary_fr": "Processeur pour tablettes (GPU PowerVR GE8300, Android 10) ; décodage H.265/H.264 en 4K à 30 i/s et VP9 seulement en 720p. Aucune TV box A133 trouvée.",
        "sources": ["src-cnx-processeur-tablette-allwinner-a133"]
      }
    ],
    "notes_fr": null
  },
  {
    "id": "allwinner-h3",
    "vendor": "Allwinner",
    "name": "H3",
    "aliases": ["H3"],
    "cores": 4,
    "arch": "Cortex-A7",
    "ram_max_gb": {
      "value": 2,
      "status": "unverified",
      "basis": "hypothesis",
      "sources": []
    },
    "ram_types": {
      "value": ["LPDDR2", "LPDDR3", "DDR3", "DDR3L"],
      "status": "unverified",
      "basis": "community",
      "sources": ["src-linux-sunxi-h3"]
    },
    "ethernet_max_mbps": {
      "value": 1000,
      "status": "unverified",
      "basis": "community",
      "sources": [
        "src-linux-sunxi-h3",
        "src-friendlyelec-fiche-zeropi-h3-ethernet-10-1",
        "src-cnx-zeropi-h3-avec-gigabit-via-phy-realtek"
      ]
    },
    "video_max_decode": {
      "value": "4K",
      "status": "unverified",
      "basis": "community",
      "sources": [
        "src-linux-sunxi-h3",
        "src-cnx-annonce-de-l-allwinner-h3-2014",
        "src-wikipedia-en-allwinner-technology-tableaux"
      ]
    },
    "community_findings": [
      {
        "topic": "ram",
        "summary_fr": "Un fil Armbian affirme que le H3 n'adresse que 2 Go au total (CPU et GPU partagent le bus), sans citer le passage de la datasheet ; un autre intervenant lit la datasheet comme 2 Go côté CPU + 2 Go côté GPU. Datasheet H3 non lisible (miroirs inaccessibles) : 2 Go reste une hypothèse.",
        "sources": ["src-forum-armbian-fil-sur-une-box-h3-limite-d"]
      },
      {
        "topic": "ethernet",
        "summary_fr": "L'annonce CNX de 2014 indique que le H3 n'a pas de Gigabit (PHY intégré 100M), alors que des cartes H3 (ZeroPi) sont vendues avec un Gigabit via PHY externe : le MAC semble gérer le Gigabit, mais la datasheet n'a pas pu le confirmer.",
        "sources": [
          "src-cnx-annonce-de-l-allwinner-h3-2014",
          "src-friendlyelec-fiche-zeropi-h3-ethernet-10-1",
          "src-cnx-zeropi-h3-avec-gigabit-via-phy-realtek"
        ]
      }
    ],
    "notes_fr": "Capacité maximale de RAM non sourcée (2 Go attendus). Le MAC gigabit nécessite un PHY externe : le PHY intégré est 10/100."
  },
  {
    "id": "allwinner-h313",
    "vendor": "Allwinner",
    "name": "H313",
    "aliases": ["H313"],
    "cores": 4,
    "arch": "Cortex-A53",
    "ram_max_gb": {
      "value": 2,
      "status": "verified",
      "basis": "vendor",
      "sources": ["src-allwinner-fiche-produit-brief-h313"]
    },
    "ram_types": {
      "value": ["DDR3", "DDR3L", "DDR4", "LPDDR3", "LPDDR4"],
      "status": "verified",
      "basis": "vendor",
      "sources": ["src-allwinner-fiche-produit-brief-h313"]
    },
    "ethernet_max_mbps": {
      "value": 1000,
      "status": "verified",
      "basis": "vendor",
      "sources": ["src-allwinner-fiche-produit-brief-h313"]
    },
    "video_max_decode": {
      "value": "4K",
      "status": "verified",
      "basis": "vendor",
      "sources": ["src-allwinner-fiche-produit-brief-h313"]
    },
    "community_findings": [
      {
        "topic": "identity",
        "summary_fr": "Le wiki linux-sunxi présente le H313 comme une variante d'entrée de gamme du H616 pour TV box.",
        "sources": ["src-linux-sunxi-h313"]
      },
      {
        "topic": "ram",
        "summary_fr": "Des fils Armbian signalent des boxes H313 dont la RAM réelle est de 1 Go malgré une annonce de 4 Go, et d'autres à 4 Go DDR3 authentiques : le SoC ne suffit pas à trancher, il faut lire les puces.",
        "sources": ["src-armbian-tx10pro-h313", "src-armbian-x96q-h313"]
      },
      {
        "topic": "ram",
        "summary_fr": "La fiche officielle du H313 annonce 2 Go maximum, alors que la note existante parlait de boxes à 4 Go DDR3 « authentiques » : dans les deux fils Armbian relus, aucun message ne rapporte de H313 réel à 4 Go (1 Go LPDDR3 constaté sur une TX10 Pro). La limite de 2 Go est cohérente avec ce qui a été lu ; les modèles annoncés à 4 Go (ex. q96-stick) restent à surveiller.",
        "sources": [
          "src-allwinner-fiche-produit-brief-h313",
          "src-armbian-tx10pro-h313",
          "src-armbian-x96q-h313"
        ]
      },
      {
        "topic": "identity",
        "summary_fr": "Même constat : une X96Q du noyau Linux est déclarée en H616 ; la variante H313 (CNX) n'est donc pas la seule révision connue sous ce nom.",
        "sources": [
          "src-noyau-linux-devicetree-d-une-x96q-compatib",
          "src-cnx-x96q-avec-allwinner-h313"
        ]
      }
    ],
    "notes_fr": "Limite de RAM à rechercher (aucune source trouvée). La fiche produit Allwinner annonce une capacité maximale de 2 Go. Des témoignages de forum décrivent pourtant des box vendues « H313 » avec 4 Go : soit la puce réelle n'est pas un H313, soit la fiche est dépassée. Une annonce au-delà de 2 Go est donc à vérifier sur les puces."
  },
  {
    "id": "allwinner-h5",
    "vendor": "Allwinner",
    "name": "H5",
    "aliases": ["H5"],
    "cores": 4,
    "arch": "Cortex-A53",
    "ram_max_gb": {
      "value": 3,
      "status": "verified",
      "basis": "datasheet",
      "sources": ["src-allwinner-datasheet-h5-rev-1-0-copie-heber"]
    },
    "ram_types": {
      "value": ["DDR3", "DDR3L"],
      "status": "verified",
      "basis": "datasheet",
      "sources": ["src-allwinner-datasheet-h5-rev-1-0-copie-heber"]
    },
    "ethernet_max_mbps": {
      "value": 1000,
      "status": "verified",
      "basis": "datasheet",
      "sources": ["src-allwinner-datasheet-h5-rev-1-0-copie-heber"]
    },
    "video_max_decode": {
      "value": "4K",
      "status": "verified",
      "basis": "datasheet",
      "sources": ["src-allwinner-datasheet-h5-rev-1-0-copie-heber"]
    },
    "community_findings": [
      {
        "topic": "identity",
        "summary_fr": "Présenté comme conçu pour les box OTT 4K ; la MX Pro 4K est décrite comme la première box à base de H5, avec un GPU Mali-450.",
        "sources": ["src-cnx-mx-pro-4k-avec-allwinner-h5"]
      }
    ],
    "notes_fr": null
  },
  {
    "id": "allwinner-h6",
    "vendor": "Allwinner",
    "name": "H6",
    "aliases": ["H6", "H6 V200"],
    "cores": 4,
    "arch": "Cortex-A53",
    "ram_max_gb": {
      "value": 3,
      "status": "unverified",
      "basis": "hypothesis",
      "sources": ["src-allwinner-h6-datasheet"]
    },
    "ram_types": {
      "value": ["DDR4", "DDR3", "DDR3L", "LPDDR2", "LPDDR3"],
      "status": "verified",
      "basis": "datasheet",
      "sources": ["src-allwinner-h6-datasheet"]
    },
    "ethernet_max_mbps": {
      "value": 1000,
      "status": "verified",
      "basis": "datasheet",
      "sources": ["src-allwinner-h6-datasheet"]
    },
    "video_max_decode": {
      "value": "4K",
      "status": "verified",
      "basis": "datasheet",
      "sources": ["src-allwinner-h6-datasheet"]
    },
    "community_findings": [
      {
        "topic": "ram",
        "summary_fr": "La datasheet H6 V200 mentionne « jusqu'à 2 Go d'espace d'adressage » avec 2 chip selects, ce qui est ambigu ; des forums rappellent par ailleurs qu'une box 4 Go n'en exploiterait que 3 Go. Les deux affirmations divergent : aucune limite n'est retenue.",
        "sources": ["src-allwinner-h6-datasheet", "src-armbian-choice-of-tv-box"]
      },
      {
        "topic": "ram",
        "summary_fr": "La datasheet H6 V200 (relue) dit « jusqu'à 2 Go d'espace d'adressage » avec 2 chip selects, alors que la fiche officielle Pine64 de la carte Pine H64 modèle B annonce jusqu'à 3 Go de LPDDR3 sur ce SoC. Deux documents officiels se contredisent : la limite reste une hypothèse (3 Go), non tranchée. Pour mémoire, la datasheet du H5 annonce, elle, 3 Go d'espace d'adressage.",
        "sources": [
          "src-allwinner-h6-datasheet",
          "src-pine64-fiche-de-la-carte-pine-h64-modele-b",
          "src-allwinner-datasheet-h5-rev-1-0-copie-heber"
        ]
      },
      {
        "topic": "video",
        "summary_fr": "Contradiction à surveiller : la datasheet H6 V200 (relue) donne H.265 jusqu'à 4K à 60 i/s, alors que l'annonce CNX de 2017 (H6 d'origine) parle de H.265 jusqu'à 6K x 4K à 30 i/s. La valeur « 4K » vérifiée par datasheet est conservée ; la différence tient peut-être à la révision V200.",
        "sources": ["src-allwinner-h6-datasheet", "src-cnx-annonce-du-processeur-allwinner-h6-201"]
      }
    ],
    "notes_fr": "Limite de RAM contradictoire entre la datasheet (2 Go d'espace d'adressage) et les retours de forums (3 Go) : valeur 3 Go conservée comme hypothèse, sans verdict."
  },
  {
    "id": "allwinner-h616",
    "vendor": "Allwinner",
    "name": "H616",
    "aliases": ["H616"],
    "cores": 4,
    "arch": "Cortex-A53",
    "ram_max_gb": {
      "value": 4,
      "status": "verified",
      "basis": "vendor",